{
  "year": 1031,
  "title": "Éclatement du califat de Cordoue",
  "lon": -3.7,
  "lat": 40.4,
  "regionId": "iberie",
  "religion": "Islam sunnite",
  "territory": "Taïfas d'Al-Andalus",
  "language": "Arabe andalou",
  "ethnicity": "Arabo-berbères",
  "desc": "Le califat omeyyade de Cordoue se fragmente en une mosaïque de royaumes de taïfas rivaux.",
  "id": "1031-eclatement-du-califat-de-cordoue"
}
