{
  "id": "bataille-hastings",
  "year": 1066,
  "title": "Bataille de Hastings",
  "lon": 0.49,
  "lat": 50.91,
  "regionId": "iles-britanniques",
  "religion": "Christianisme catholique",
  "territory": "Angleterre normande",
  "language": "Ancien français",
  "ethnicity": "Normands",
  "desc": "Guillaume le Conquérant vainc Harold Godwinson et prend le contrôle de l'Angleterre.",
  "sources": [
    {
      "author": "Exemple",
      "title": "Une source à compléter",
      "url": "https://example.org/source"
    }
  ]
}