{
  "year": 1071,
  "title": "Bataille de Manzikert",
  "lon": 42.6,
  "lat": 39.1,
  "regionId": "byzance",
  "religion": "Christianisme orthodoxe",
  "territory": "Empire byzantin",
  "language": "Grec",
  "ethnicity": "Byzantins",
  "desc": "La défaite byzantine face aux Turcs seldjoukides ouvre l'Anatolie à la turquisation et à l'islamisation.",
  "id": "1071-bataille-de-manzikert"
}
