{
  "year": 1206,
  "title": "Gengis Khan proclamé empereur mongol",
  "lon": 109.0,
  "lat": 48.0,
  "regionId": "steppe",
  "religion": "Chamanisme",
  "territory": "Empire mongol",
  "language": "Mongol",
  "ethnicity": "Mongols",
  "desc": "Temüjin unifie les tribus mongoles, ouvrant l'ère des grandes conquêtes eurasiatiques.",
  "id": "1206-gengis-khan-proclame-empereur-mongol"
}
