{
  "year": 1275,
  "title": "Marco Polo à la cour de Kubilai Khan",
  "lon": 116.4,
  "lat": 39.9,
  "regionId": "chine",
  "religion": "Bouddhisme",
  "territory": "Chine des Yuan (mongole)",
  "language": "Chinois",
  "ethnicity": "Han",
  "desc": "Le marchand vénitien atteint la cour de Kubilai Khan, symbole de la paix mongole sur la route de la soie.",
  "id": "1275-marco-polo-a-la-cour-de-kubilai-khan"
}
