{
  "year": 916,
  "title": "Fondation de la dynastie Liao",
  "lon": 112.0,
  "lat": 43.5,
  "regionId": "steppe",
  "religion": "Bouddhisme",
  "territory": "Liao",
  "language": "Khitan",
  "ethnicity": "Khitans",
  "desc": "Abaoji fonde l'empire Liao, semi-nomade, rival de la Chine des Song pendant deux siècles.",
  "id": "916-fondation-de-la-dynastie-liao"
}
