{
  "year": 1099,
  "title": "Prise de Jérusalem par les croisés",
  "lon": 35.23,
  "lat": 31.78,
  "regionId": "levant",
  "religion": "Christianisme catholique",
  "territory": "Califat abbasside",
  "language": "Arabe",
  "ethnicity": "Arabes",
  "desc": "La première croisade fonde un royaume latin à Jérusalem, ouvrant deux siècles de présence européenne au Levant.",
  "id": "1099-prise-de-jerusalem-par-les-croises"
}
