{
  "year": 969,
  "title": "Fondation du Caire par les Fatimides",
  "lon": 31.24,
  "lat": 30.05,
  "regionId": "egypte",
  "religion": "Islam chiite",
  "territory": "Califat fatimide",
  "language": "Arabe",
  "ethnicity": "Arabo-coptes",
  "desc": "Les Fatimides conquièrent l'Égypte et fondent Le Caire comme nouvelle capitale califale, rivale de Bagdad.",
  "id": "969-fondation-du-caire-par-les-fatimides"
}
