{
  "year": 1185,
  "title": "Shogunat de Kamakura",
  "lon": 139.55,
  "lat": 35.32,
  "regionId": "japon",
  "religion": "Bouddhisme",
  "territory": "Japon (shogunat de Kamakura)",
  "language": "Japonais",
  "ethnicity": "Japonais",
  "desc": "Minamoto no Yoritomo instaure le premier shogunat, transférant le pouvoir réel à la caste guerrière.",
  "id": "1185-shogunat-de-kamakura"
}
