{
  "year": 1054,
  "title": "Grand Schisme d'Orient",
  "lon": 28.98,
  "lat": 41.0,
  "regionId": "byzance",
  "religion": "Christianisme orthodoxe",
  "territory": "Empire byzantin",
  "language": "Grec",
  "ethnicity": "Byzantins",
  "desc": "La rupture entre Rome et Constantinople formalise la fracture entre christianisme latin et orthodoxe.",
  "id": "1054-grand-schisme-d-orient"
}
