{
  "year": 793,
  "title": "Raid viking sur Lindisfarne",
  "lon": -1.8,
  "lat": 55.7,
  "regionId": "iles-britanniques",
  "religion": "Paganisme nordique",
  "territory": "Scandinavie",
  "language": "Vieux norrois",
  "ethnicity": "Scandinaves",
  "desc": "Le pillage du monastère de Lindisfarne marque le début de l'ère viking en Europe occidentale.",
  "id": "793-raid-viking-sur-lindisfarne"
}
