{
  "year": 1000,
  "title": "Léif Erikson atteint le Vinland",
  "lon": -55.5,
  "lat": 51.6,
  "regionId": "scandinavie",
  "religion": "Christianisme catholique",
  "territory": "Scandinavie",
  "language": "Vieux norrois",
  "ethnicity": "Scandinaves",
  "desc": "Léif Erikson aborde les côtes d'Amérique du Nord, cinq siècles avant Colomb.",
  "id": "1000-leif-erikson-atteint-le-vinland"
}
