{
  "year": 911,
  "title": "Traité de Saint-Clair-sur-Epte",
  "lon": 1.1,
  "lat": 49.4,
  "regionId": "francie",
  "religion": "Christianisme catholique",
  "territory": "Normandie",
  "language": "Vieux norrois",
  "ethnicity": "Scandinaves",
  "desc": "Charles le Simple cède la Normandie au chef viking Rollon, qui se convertit : naissance du duché de Normandie.",
  "id": "911-traite-de-saint-clair-sur-epte"
}
