{
  "year": 1279,
  "title": "Conquête mongole de la Chine des Song",
  "lon": 113.3,
  "lat": 23.1,
  "regionId": "chine",
  "religion": "Bouddhisme",
  "territory": "Chine des Yuan (mongole)",
  "language": "Chinois",
  "ethnicity": "Han",
  "desc": "Kubilai Khan achève la conquête de la Chine des Song, fondant la dynastie Yuan.",
  "id": "1279-conquete-mongole-de-la-chine-des-song"
}
