{
  "year": 1125,
  "title": "Chute des Liao face aux Jürchen",
  "lon": 112.0,
  "lat": 43.5,
  "regionId": "steppe",
  "religion": "Bouddhisme",
  "territory": "Empire Jin (Jürchen)",
  "language": "Jürchen",
  "ethnicity": "Jürchen",
  "desc": "Les Jürchen renversent la dynastie Liao et fondent l'empire Jin en Mandchourie et Chine du Nord.",
  "id": "1125-chute-des-liao-face-aux-jurchen"
}
