{
  "year": 929,
  "title": "Califat de Cordoue proclamé",
  "lon": -4.78,
  "lat": 37.88,
  "regionId": "iberie",
  "religion": "Islam sunnite",
  "territory": "Califat de Cordoue",
  "language": "Arabe andalou",
  "ethnicity": "Arabo-berbères",
  "desc": "Abd al-Rahman III se proclame calife à Cordoue, rival de Bagdad et foyer de savoir méditerranéen.",
  "id": "929-califat-de-cordoue-proclame"
}
