{
  "year": 1124,
  "title": "Fondation du Qara Khitaï",
  "lon": 75.0,
  "lat": 42.9,
  "regionId": "asie-centrale",
  "religion": "Bouddhisme",
  "territory": "Qara Khitaï",
  "language": "Khitan",
  "ethnicity": "Khitans",
  "desc": "Après la chute des Liao, une partie de l'élite khitane fuit vers l'Asie centrale.",
  "id": "1124-fondation-du-qara-khitai"
}
