{
  "year": 988,
  "title": "Baptême de Vladimir de Kiev",
  "lon": 30.5,
  "lat": 50.45,
  "regionId": "rus",
  "religion": "Christianisme orthodoxe",
  "territory": "Rus' de Kiev",
  "language": "Vieux slave oriental",
  "ethnicity": "Rus'",
  "desc": "Le prince Vladimir adopte le christianisme byzantin, liant la Rus' à Constantinople plutôt qu'à Rome.",
  "id": "988-bapteme-de-vladimir-de-kiev"
}
