{
  "year": 1076,
  "title": "Déclin de l'empire du Ghana",
  "lon": -8.0,
  "lat": 15.7,
  "regionId": "afrique-ouest",
  "religion": "Islam sunnite",
  "territory": "Royaumes soninké affaiblis",
  "language": "Soninké",
  "ethnicity": "Soninkés",
  "desc": "Affaibli par les invasions almoravides, le royaume du Ghana entame son déclin.",
  "id": "1076-declin-de-l-empire-du-ghana"
}
