{
  "year": 962,
  "title": "Otton Ier couronné empereur",
  "lon": 12.5,
  "lat": 41.9,
  "regionId": "francie",
  "religion": "Christianisme catholique",
  "territory": "Francie / Saint-Empire",
  "language": "Ancien français",
  "ethnicity": "Francs",
  "desc": "Le pape couronne Otton Ier, fondant le Saint-Empire romain germanique.",
  "id": "962-otton-ier-couronne-empereur"
}
