{
  "year": 1187,
  "title": "Saladin reprend Jérusalem",
  "lon": 35.23,
  "lat": 31.78,
  "regionId": "levant",
  "religion": "Islam sunnite",
  "territory": "Califat abbasside",
  "language": "Arabe",
  "ethnicity": "Arabes",
  "desc": "Saladin, fondateur des Ayyoubides, reprend Jérusalem aux croisés.",
  "id": "1187-saladin-reprend-jerusalem"
}
