{
  "year": 1337,
  "title": "Début de la guerre de Cent Ans",
  "lon": 2.35,
  "lat": 48.85,
  "regionId": "francie",
  "religion": "Christianisme catholique",
  "territory": "Francie / Saint-Empire",
  "language": "Ancien français",
  "ethnicity": "Francs",
  "desc": "Le conflit dynastique entre Plantagenêts et Valois s'ouvre en Europe occidentale.",
  "id": "1337-debut-de-la-guerre-de-cent-ans"
}
