{
  "year": 1037,
  "title": "Les Seldjoukides prennent la Perse",
  "lon": 59.6,
  "lat": 36.3,
  "regionId": "perse",
  "religion": "Islam sunnite",
  "territory": "Sultanat seldjoukide",
  "language": "Persan",
  "ethnicity": "Perses / Turcs",
  "desc": "La dynastie turque seldjoukide s'impose en Perse, avant de bousculer Byzance à Manzikert en 1071.",
  "id": "1037-les-seldjoukides-prennent-la-perse"
}
