{
  "year": 1240,
  "title": "Sac de Kiev par les Mongols",
  "lon": 30.5,
  "lat": 50.45,
  "regionId": "rus",
  "religion": "Christianisme orthodoxe",
  "territory": "Principautés russes (Horde d'or)",
  "language": "Vieux slave oriental",
  "ethnicity": "Rus'",
  "desc": "Les armées mongoles détruisent Kiev, installant la domination de la Horde d'or sur les principautés russes.",
  "id": "1240-sac-de-kiev-par-les-mongols"
}
